[
  {
    "exercise_id": "ex_knee_001",
    "name_et": "Jalapress masinal",
    "name_en": "Machine Leg Press",
    "movement_pattern_primary": "knee_dominant",
    "movement_pattern_secondary": [
      "hip_extension"
    ],
    "training_function": "primary_compound",
    "biomechanical_function": "bilateral_knee_dominant_press",
    "exercise_type": "compound",
    "equipment_primary": "machine",
    "equipment_secondary": [],
    "body_position": "seated",
    "bilateral_unilateral": "bilateral",
    "open_closed_chain": "closed_chain",
    "primary_muscles": [
      "quadriceps"
    ],
    "secondary_muscles": [
      "gluteus_maximus",
      "hamstrings"
    ],
    "stabilizers": [
      "core"
    ],
    "direct_load_weights": {
      "quadriceps": 1.0,
      "gluteus_maximus": 0.4,
      "hamstrings": 0.2
    },
    "indirect_load_weights": {
      "core": 0.2
    },
    "muscle_length_profile": "lengthened",
    "beginner_suitability": 5,
    "intermediate_suitability": 5,
    "advanced_suitability": 4,
    "technical_complexity": 2,
    "learning_difficulty": 2,
    "stability_requirement": 1,
    "coordination_requirement": 1,
    "mobility_requirement": 2,
    "fatigue_cost": 4,
    "time_cost": 3,
    "setup_time": "moderate",
    "default_sets": "3-4",
    "default_reps": "8-12",
    "default_rest_seconds": "90-120",
    "tempo_numeric": "3-1-1-0",
    "tempo_text_et": "Langeta kelku kontrollitult, hoia alumises asendis lühike paus ja suru raskus jõuliselt üles.",
    "instructions_et": "Istu masinale, aseta jalad platvormile puusade kuni õlgade laiuselt. Langeta raskus kontrollitult, kuni põlved on mugavas ja valuvabas asendis painutatud. Suru platvorm üles läbi terve labajala, hoides põlved varvastega samas suunas.",
    "breathing_et": "Hinga sisse raskuse langetamisel ja hinga välja platvormi üles surudes.",
    "common_mistakes_et": [
      "Põlved vajuvad sissepoole",
      "Alaselg kaardub või tõuseb istmelt",
      "Raskus surutakse ainult päkkadega",
      "Liigutus jääb liiga lühikeseks"
    ],
    "coaching_cues_et": [
      "Suru läbi terve talla",
      "Hoia põlved varvaste suunas",
      "Kontrolli langetust",
      "Ära lukusta põlvi järsult"
    ],
    "what_to_feel_et": {
      "should_feel": [
        "reie esiosa",
        "tuharad"
      ],
      "may_feel": [
        "reie tagaosa",
        "kerelihased"
      ],
      "should_not_feel": [
        "põlvevalu",
        "alaselja valu"
      ]
    },
    "contraindications": [
      "acute_knee_pain_unassessed"
    ],
    "caution_flags": [
      "knee_pain",
      "hip_mobility_limit"
    ],
    "alternatives": [
      "Hack Squat",
      "Smith Squat",
      "Goblet Squat",
      "Belt Squat"
    ],
    "progression_candidates": [
      "Hack Squat",
      "Barbell Squat"
    ],
    "regression_candidates": [
      "Box Squat",
      "Smith Squat"
    ],
    "substitution_group": "knee_dominant_compound",
    "evidence_ids": [],
    "client_visible": true,
    "status": "draft",
    "version": "1.0"
  },
  {
    "exercise_id": "ex_knee_002",
    "name_et": "Kükk Smithi masinal",
    "name_en": "Smith Machine Squat",
    "movement_pattern_primary": "knee_dominant",
    "movement_pattern_secondary": [
      "hip_extension"
    ],
    "training_function": "primary_compound",
    "biomechanical_function": "bilateral_knee_dominant_squat",
    "exercise_type": "compound",
    "equipment_primary": "smith_machine",
    "equipment_secondary": [],
    "body_position": "standing",
    "bilateral_unilateral": "bilateral",
    "open_closed_chain": "closed_chain",
    "primary_muscles": [
      "quadriceps"
    ],
    "secondary_muscles": [
      "gluteus_maximus",
      "hamstrings"
    ],
    "stabilizers": [
      "core"
    ],
    "direct_load_weights": {
      "quadriceps": 1.0,
      "gluteus_maximus": 0.5,
      "hamstrings": 0.2
    },
    "indirect_load_weights": {
      "core": 0.3
    },
    "muscle_length_profile": "lengthened",
    "beginner_suitability": 5,
    "intermediate_suitability": 4,
    "advanced_suitability": 3,
    "technical_complexity": 2,
    "learning_difficulty": 2,
    "stability_requirement": 1,
    "coordination_requirement": 2,
    "mobility_requirement": 3,
    "fatigue_cost": 4,
    "time_cost": 3,
    "setup_time": "moderate",
    "default_sets": "3-4",
    "default_reps": "8-12",
    "default_rest_seconds": "90-120",
    "tempo_numeric": "3-1-1-0",
    "tempo_text_et": "Lasku kontrollitult, hoia alumises asendis hetk ja tõuse jõuliselt üles.",
    "instructions_et": "Aseta kang ülaseljale, seisa jalad puusade kuni õlgade laiuselt. Lasku kükki kontrollitult, hoides põlved varvastega samas suunas. Tõuse üles läbi terve talla.",
    "breathing_et": "Hinga sisse laskumisel ja välja üles tõustes.",
    "common_mistakes_et": [
      "Liiga suur ette- või tahakalle",
      "Põlved vajuvad sisse",
      "Kannad tõusevad",
      "Liiga lühike liigutusulatus"
    ],
    "coaching_cues_et": [
      "Hoia rind avatud",
      "Põlved varvaste suunas",
      "Suru põrand endast eemale",
      "Kontrollitud laskumine"
    ],
    "what_to_feel_et": {
      "should_feel": [
        "reie esiosa",
        "tuharad"
      ],
      "may_feel": [
        "kerelihased"
      ],
      "should_not_feel": [
        "terav põlvevalu",
        "alaseljavalu"
      ]
    },
    "contraindications": [],
    "caution_flags": [
      "knee_pain",
      "fear_of_squat"
    ],
    "alternatives": [
      "Leg Press",
      "Goblet Squat",
      "Hack Squat",
      "Box Squat"
    ],
    "progression_candidates": [
      "Goblet Squat",
      "Barbell Back Squat"
    ],
    "regression_candidates": [
      "Leg Press",
      "Box Squat"
    ],
    "substitution_group": "knee_dominant_compound",
    "evidence_ids": [],
    "client_visible": true,
    "status": "draft",
    "version": "1.0"
  },
  {
    "exercise_id": "ex_knee_003",
    "name_et": "Kükk hantliga",
    "name_en": "Dumbbell Squat",
    "movement_pattern_primary": "knee_dominant",
    "movement_pattern_secondary": [
      "hip_extension"
    ],
    "training_function": "primary_compound",
    "biomechanical_function": "bilateral_knee_dominant_squat",
    "exercise_type": "compound",
    "equipment_primary": "dumbbell",
    "equipment_secondary": [],
    "body_position": "standing",
    "bilateral_unilateral": "bilateral",
    "open_closed_chain": "closed_chain",
    "primary_muscles": [
      "quadriceps"
    ],
    "secondary_muscles": [
      "gluteus_maximus",
      "hamstrings"
    ],
    "stabilizers": [
      "core",
      "upper_back"
    ],
    "direct_load_weights": {
      "quadriceps": 1.0,
      "gluteus_maximus": 0.45,
      "hamstrings": 0.2
    },
    "indirect_load_weights": {
      "core": 0.4,
      "upper_back": 0.2
    },
    "muscle_length_profile": "lengthened",
    "beginner_suitability": 4,
    "intermediate_suitability": 4,
    "advanced_suitability": 3,
    "technical_complexity": 3,
    "learning_difficulty": 3,
    "stability_requirement": 3,
    "coordination_requirement": 3,
    "mobility_requirement": 3,
    "fatigue_cost": 3,
    "time_cost": 2,
    "setup_time": "low",
    "default_sets": "3",
    "default_reps": "8-12",
    "default_rest_seconds": "90",
    "tempo_numeric": "3-1-1-0",
    "tempo_text_et": "Lasku rahulikult ja tõuse kontrollitult üles.",
    "instructions_et": "Hoia hantleid külgedel või üht hantlit keha ees. Lasku kükki, hoides kere kontrolli all ja põlved varvastega samas suunas. Tõuse üles läbi terve talla.",
    "breathing_et": "Hinga sisse laskudes, hinga välja üles tõustes.",
    "common_mistakes_et": [
      "Kere vajub liigselt ette",
      "Põlved vajuvad sisse",
      "Kannad tõusevad",
      "Hantlid kisuvad keha tasakaalust välja"
    ],
    "coaching_cues_et": [
      "Suru läbi kanna ja päka",
      "Hoia kõht pinges",
      "Liigu kontrollitult",
      "Põlved varvastega samas suunas"
    ],
    "what_to_feel_et": {
      "should_feel": [
        "reie esiosa",
        "tuharad"
      ],
      "may_feel": [
        "kerelihased",
        "ülaselg"
      ],
      "should_not_feel": [
        "põlvevalu",
        "alaselja valu"
      ]
    },
    "contraindications": [],
    "caution_flags": [
      "balance_limitation",
      "knee_pain"
    ],
    "alternatives": [
      "Smith Squat",
      "Goblet Squat",
      "Leg Press"
    ],
    "progression_candidates": [
      "Goblet Squat",
      "Barbell Squat"
    ],
    "regression_candidates": [
      "Smith Squat",
      "Box Squat"
    ],
    "substitution_group": "knee_dominant_compound",
    "evidence_ids": [],
    "client_visible": true,
    "status": "draft",
    "version": "1.0"
  },
  {
    "exercise_id": "ex_knee_004",
    "name_et": "Goblet-kükk",
    "name_en": "Goblet Squat",
    "movement_pattern_primary": "knee_dominant",
    "movement_pattern_secondary": [
      "hip_extension"
    ],
    "training_function": "primary_compound",
    "biomechanical_function": "bilateral_knee_dominant_squat",
    "exercise_type": "compound",
    "equipment_primary": "dumbbell",
    "equipment_secondary": [
      "kettlebell"
    ],
    "body_position": "standing",
    "bilateral_unilateral": "bilateral",
    "open_closed_chain": "closed_chain",
    "primary_muscles": [
      "quadriceps"
    ],
    "secondary_muscles": [
      "gluteus_maximus",
      "hamstrings"
    ],
    "stabilizers": [
      "core",
      "upper_back"
    ],
    "direct_load_weights": {
      "quadriceps": 1.0,
      "gluteus_maximus": 0.45,
      "hamstrings": 0.2
    },
    "indirect_load_weights": {
      "core": 0.5,
      "upper_back": 0.3
    },
    "muscle_length_profile": "lengthened",
    "beginner_suitability": 4,
    "intermediate_suitability": 5,
    "advanced_suitability": 3,
    "technical_complexity": 3,
    "learning_difficulty": 3,
    "stability_requirement": 3,
    "coordination_requirement": 3,
    "mobility_requirement": 3,
    "fatigue_cost": 3,
    "time_cost": 2,